{
  "slug": "the-castles-of-burgundy-2019",
  "name": "The Castles of Burgundy",
  "year": 2019,
  "bggId": 84876,
  "templateVersion": 1,
  "variant": "2019 edition (base)",
  "playerCount": {
    "min": 1,
    "max": 4
  },
  "mode": "competitive",
  "winRule": "highest",
  "scoringStyle": "running-track",
  "rounds": null,
  "categories": [
    {
      "key": "trackScore",
      "label": "Victory point track (before final scoring)",
      "labelVi": "Điểm trên track (trước tính điểm cuối)",
      "hint": "Total on the VP track, incl. completed regions, phase bonuses, bonus tiles, animals, sales. Add 100/200 if tile flipped",
      "scope": "player",
      "input": "number",
      "min": 0,
      "formula": {
        "type": "sum"
      },
      "countsToTotal": true
    },
    {
      "key": "unsoldGoods",
      "label": "Unsold goods tiles",
      "labelVi": "Hàng chưa bán",
      "hint": "1 VP per goods tile left in storage",
      "scope": "player",
      "input": "count",
      "min": 0,
      "formula": {
        "type": "multiply",
        "points": 1
      },
      "countsToTotal": true
    },
    {
      "key": "silverlings",
      "label": "Remaining Silverlings",
      "labelVi": "Silverling còn lại",
      "hint": "1 VP each",
      "scope": "player",
      "input": "count",
      "min": 0,
      "formula": {
        "type": "multiply",
        "points": 1
      },
      "countsToTotal": true
    },
    {
      "key": "workers",
      "label": "Worker tiles",
      "labelVi": "Thẻ công nhân",
      "hint": "1 VP per 2 workers",
      "scope": "player",
      "input": "count",
      "min": 0,
      "formula": {
        "type": "expr",
        "expr": "floor(value/2)"
      },
      "countsToTotal": true
    },
    {
      "key": "yellowGoodsTypesSold",
      "label": "Tile 15: goods types sold",
      "labelVi": "Ô vàng 15: loại hàng đã bán",
      "hint": "3 VP per goods type sold at least once (needs tile 15)",
      "scope": "player",
      "input": "count",
      "min": 0,
      "max": 6,
      "formula": {
        "type": "multiply",
        "points": 3
      },
      "countsToTotal": true
    },
    {
      "key": "yellowBuildingTiles",
      "label": "Tiles 16-23: matching buildings",
      "labelVi": "Ô vàng 16-23: công trình tương ứng",
      "hint": "4 VP per building of each type whose yellow tile you own",
      "scope": "player",
      "input": "count",
      "min": 0,
      "formula": {
        "type": "multiply",
        "points": 4
      },
      "countsToTotal": true
    },
    {
      "key": "yellowAnimalTypes",
      "label": "Tile 24: animal types",
      "labelVi": "Ô vàng 24: loại vật nuôi",
      "hint": "4 VP per animal type in your estate (needs tile 24)",
      "scope": "player",
      "input": "count",
      "min": 0,
      "max": 4,
      "formula": {
        "type": "multiply",
        "points": 4
      },
      "countsToTotal": true
    },
    {
      "key": "yellowSoldGoods",
      "label": "Tile 25: sold goods tiles",
      "labelVi": "Ô vàng 25: số hàng đã bán",
      "hint": "1 VP per sold goods tile (needs tile 25)",
      "scope": "player",
      "input": "count",
      "min": 0,
      "formula": {
        "type": "multiply",
        "points": 1
      },
      "countsToTotal": true
    },
    {
      "key": "yellowBonusTiles",
      "label": "Tile 26: bonus tiles claimed",
      "labelVi": "Ô vàng 26: ô thưởng đã nhận",
      "hint": "2 VP per bonus tile claimed, large or small (needs tile 26)",
      "scope": "player",
      "input": "count",
      "min": 0,
      "max": 12,
      "formula": {
        "type": "multiply",
        "points": 2
      },
      "countsToTotal": true
    }
  ],
  "tiebreakers": [
    {
      "categoryKey": null,
      "dir": "lowest",
      "description": "Fewest empty estate spaces"
    },
    {
      "categoryKey": null,
      "dir": null,
      "description": "Still tied: the player who went later in turn order wins"
    }
  ],
  "sharedVictoryOnTie": false,
  "notes": "Points during play (in-play): animals score immediately incl. re-scoring same animal type in the pasture; selling goods 2-4 VP per tile; completed region scores by size (1-8 spaces: 1-36 VP) plus phase bonus (10 in phase A down to 2 in E); first to cover a colour takes the large bonus tile (5/6/7 VP for 2/3/4 players), second takes small tile (2-4 VP). All of that is already on the VP track. Six-sided tiles left in storage score nothing. Yellow tile rows apply only if you own that tile; each row is count x points. Solo mode has its own target score (not modelled). Rulebook used is the Ravensburger/alea English rulebook; the 2019 edition PDF could not be fetched directly but a search extract of it matched the same final scoring and tiebreakers.",
  "sources": [
    {
      "url": "https://cdn.1j1ju.com/medias/04/f5/f9-the-castles-of-burgundy-rulebook.pdf",
      "title": "The Castles of Burgundy Rulebook (Ravensburger/alea)",
      "type": "official-rulebook",
      "section": "p.8-9 region/bonus scoring, final scoring and tiebreakers; p.10-11 yellow tiles 15-26"
    },
    {
      "url": "https://www.fgbradleys.com/wp-content/uploads/castles-of-burgundy-2019.pdf",
      "title": "The Castles of Burgundy 2019 rulebook (FGB)",
      "type": "official-rulebook",
      "section": "Final scoring (verified via search extract only; direct fetch failed)"
    },
    {
      "url": "https://www.yucata.de/en/Rules/CastlesOfBurgundy",
      "title": "Yucata - Rules - The Castles of Burgundy",
      "type": "other",
      "section": "Final scoring cross-check"
    }
  ],
  "confidence": "high",
  "needsReview": false
}
